{
  "id": "example-czech-greeting",
  "title": "Dialogue in Czech about a greeting",
  "timestamp": "2026-10-22T19:00:00.000Z",
  "sourceText": "Anna: Dobrý den!",
  "sourceLang": "Czech",
  "targetLang": "English",
  "annotation": {
    "textType": "dialogue",
    "stanzas": [{"lines": [{
      "speaker": "Anna",
      "idiomaticTranslation": "Hello!",
      "words": [
        {"original": "Dobrý", "translation": "Good", "grammar": "Adj: Nom, Masc, Sg"},
        {"original": "den", "translation": "day", "grammar": "Noun: Nom, Masc, Sg"},
        {"original": "!", "translation": "!", "grammar": "Punct"}
      ]
    }]}]
  }
}
